{
  "$schema": "PHILOSOPHY_SEMANTIC_CACHE_ADMISSION_POLICY.schema.json",
  "policy_id": "philosophy_semantic_cache_admission_policy",
  "policy_version": "2026-05-20",
  "rollout_phase": "PHILOSOPHY-PR2",
  "gate_status": "closed",
  "runtime_allowed": false,
  "implementation_allowed": false,
  "source_contract": "docs/orchestration/contracts/PHILOSOPHY_SEMANTIC_CACHE_ADMISSION_CONTRACT.md",
  "modal_operators": [
    "can",
    "may",
    "must",
    "should",
    "could",
    "would",
    "might",
    "will",
    "is required to",
    "has to"
  ],
  "temporal_operators": [
    "now",
    "still",
    "remains",
    "became",
    "has been",
    "will",
    "future"
  ],
  "research_basis": [
    "Kuhn 2014 controlled natural language: restrict vocabulary and grammar to reduce ambiguity",
    "QuickCheck property testing: generated cases exercise property classes instead of hand examples only",
    "metamorphic testing: oracle-gap coverage through paired forbidden and allowed transformations",
    "OPA/Rego policy-as-data: structured JSON-like data keeps policy inputs auditable",
    "NIST AI RMF red-teaming: adversarial role-play and chaos testing surface failure modes before rollout",
    "temporal/modal logic: tense and modality change claim force even when terms are reused"
  ],
  "claim_families": [
    {
      "id": "claim_class_gate_open_equivalence",
      "risk_rail": "semantic_cache_gate_integrity",
      "canonical_meaning": "Philosophy admission, PR-1, PR-2, or the claim-family oracle is equivalent to opening, unlocking, enabling, or keeping open the semantic-cache gate.",
      "forbidden_polarity": "affirmative permission, activation, equivalence, double-negative, or temporal drift that makes the gate open now, still open, or open in this PR",
      "detector_labels": [
        "philosophy admission opens gate"
      ],
      "subjects": [
        "PR-1",
        "PR-2",
        "Philosophy admission",
        "The admission contract",
        "The admission policy",
        "The claim-family oracle",
        "The semantic-cache gate",
        "The global gate"
      ],
      "assertive_predicates": [
        "opens the semantic-cache gate",
        "unlocks the semantic-cache gate",
        "enables the global gate",
        "is equivalent to opening the semantic-cache gate",
        "keeps the semantic-cache gate open"
      ],
      "modal_predicates": [
        "open the semantic-cache gate",
        "unlock the semantic-cache gate",
        "enable the global gate",
        "be equivalent to opening the semantic-cache gate"
      ],
      "temporal_predicates": [
        "has opened the semantic-cache gate",
        "became sufficient to open the semantic-cache gate",
        "remains enough to open the global gate",
        "is now opening the semantic-cache gate",
        "still keeps the semantic-cache gate open"
      ],
      "seed_regressions": [
        "The claim-family oracle became sufficient to open the semantic-cache gate.",
        "PR-2 does not only open the semantic-cache gate.",
        "The semantic-cache gate is now being opened for PR-2."
      ],
      "allowed_negative_controls": [
        "This policy does not open the semantic-cache gate.",
        "No semantic-cache gate is opened by PR-2.",
        "The future gate-open PR must review semantic-cache admission before runtime use."
      ]
    },
    {
      "id": "claim_class_live_philosophy_cache",
      "risk_rail": "runtime_serving_integrity",
      "canonical_meaning": "Philosophical semantic-cache serving, cache reads, or live cache status is present before the global semantic-cache gate opens.",
      "forbidden_polarity": "affirmative live, serving, active, ready, open, or still-live runtime cache status",
      "detector_labels": [
        "philosophical semantic cache live"
      ],
      "subjects": [
        "Philosophical semantic-cache",
        "Philosophy cache",
        "Philosophy admission cache",
        "PR-2 cache path",
        "The policy oracle"
      ],
      "assertive_predicates": [
        "is live",
        "is active",
        "serves cached responses",
        "serves philosophy cache hits",
        "keeps semantic-cache serving live"
      ],
      "modal_predicates": [
        "serve cached responses",
        "keep semantic-cache serving live",
        "return philosophy cache hits",
        "run as a live cache"
      ],
      "temporal_predicates": [
        "has been live",
        "became live",
        "remains live",
        "is still serving cached responses",
        "will serve cached responses"
      ],
      "seed_regressions": [
        "The admission policy still keeps semantic-cache serving live.",
        "Philosophy admission has been live since PR-1.",
        "Future philosophy PRs may now serve cached responses."
      ],
      "allowed_negative_controls": [
        "Philosophical semantic-cache is not live.",
        "The policy oracle does not serve cached responses.",
        "Future PR may evaluate cache serving only after the gate opens."
      ]
    },
    {
      "id": "claim_class_provider_rollout_approved",
      "risk_rail": "provider_and_dependency_integrity",
      "canonical_meaning": "PR-1 or PR-2 approves Redis, GPTCache, embeddings, vector search, connection strings, cache adapters, or provider-backed cache runtime.",
      "forbidden_polarity": "affirmative permission, support, import, wiring, connection, provider call, or temporal provider rollout approval",
      "detector_labels": [
        "redis philosophical cache approved",
        "gptcache philosophical cache approved",
        "redis imports allowed in pr-1",
        "gptcache imports allowed in pr-1",
        "embeddings allowed in pr-1",
        "insight cache wiring allowed in pr-1",
        "vector search allowed in pr-1",
        "connection strings allowed in pr-1",
        "cache adapters allowed in pr-1"
      ],
      "subjects": [
        "PR-1",
        "PR-2",
        "Philosophy admission",
        "The admission policy",
        "The claim-family oracle"
      ],
      "assertive_predicates": [
        "allows Redis imports",
        "allows GPTCache imports",
        "enables embeddings for philosophy admission",
        "wires /insight cache behavior",
        "opens Redis connection strings"
      ],
      "modal_predicates": [
        "use Redis clients",
        "use GPTCache clients",
        "wire embeddings",
        "open Redis connections",
        "enable provider-backed cache"
      ],
      "temporal_predicates": [
        "has used Redis imports for philosophy admission",
        "became approved for GPTCache imports",
        "still allows embeddings",
        "will wire /insight cache behavior",
        "has been opening Redis connections"
      ],
      "seed_regressions": [
        "Future philosophy PRs may now serve GPTCache responses.",
        "Philosophy admission has been required to enable Redis cache I/O.",
        "PR-2 has GPTCache import for philosophy admission."
      ],
      "allowed_negative_controls": [
        "No Redis imports are allowed in PR-2.",
        "GPTCache imports remain blocked for philosophy admission.",
        "The policy oracle does not enable provider-backed cache."
      ]
    },
    {
      "id": "claim_class_verification_bundle_skipped",
      "risk_rail": "verification_bundle_integrity",
      "canonical_meaning": "Semantic-cache admission or knowledge promotion may skip, waive, omit, or make optional the required verification bundle.",
      "forbidden_polarity": "affirmative waiver, optionality, omission, bypass, not-required, or temporal loosening of verification-bundle requirements",
      "detector_labels": [
        "verification bundle optional",
        "cache admission without verification bundle"
      ],
      "subjects": [
        "Semantic-cache admission",
        "Cache admission",
        "Knowledge promotion",
        "Philosophy admission",
        "The admission policy"
      ],
      "assertive_predicates": [
        "does not require a verification bundle",
        "bypasses verification bundles",
        "waives verification bundle requirements",
        "makes verification bundles optional",
        "promotes knowledge without a verification bundle"
      ],
      "modal_predicates": [
        "skip verification bundles",
        "omit the verification bundle",
        "waive verification bundle requirements",
        "promote knowledge without a verification bundle"
      ],
      "temporal_predicates": [
        "has bypassed verification bundles",
        "became exempt from verification bundles",
        "remains optional for verification bundles",
        "is now waiving verification bundle requirements",
        "will promote knowledge without a verification bundle"
      ],
      "seed_regressions": [
        "Semantic-cache admission may omit the verification bundle.",
        "Verification bundle requirements remain optional for semantic-cache admission.",
        "PR-2 is promoting knowledge without a verification bundle."
      ],
      "allowed_negative_controls": [
        "No semantic-cache admission may omit the verification bundle.",
        "Cache admission requires a passed verification bundle.",
        "Future PR may evaluate semantic-cache admission after verification."
      ]
    },
    {
      "id": "claim_class_production_live_cache_key_behavior",
      "risk_rail": "production_cache_key_integrity",
      "canonical_meaning": "Philosophy admission ships production-live cache-key behavior or raw prompt/response cache persistence.",
      "forbidden_polarity": "affirmative production-live cache keys, raw prompt cache keys, raw responses, persistence, or temporal shipping language",
      "detector_labels": [
        "production-live philosophical cache-key behavior"
      ],
      "subjects": [
        "PR-1",
        "PR-2",
        "Philosophy admission",